taxType,taxName,payee,recip,taxId,railRoad,garnTypeInd,garnCapLimit
1,WITHHOLDING TAX,EE,1,0,0,0,0
2,EARNED INCOME CREDIT PAYMENT,EE,0,0,0,0,0
3,EMPLOYEE SOCIAL SECURITY TAX,EE,0,0,1,0,0
4,EMPLOYER SOCIAL SECURITY TAX,ER,0,0,1,0,0
5,EMPLOYEE MEDICARE TAX,EE,0,0,1,0,0
6,EMPLOYER MEDICARE TAX,ER,0,0,1,0,0
7,STATE UNEMPLOYMENT INSURANCE TAX,ER,0,0,0,0,0
8,SOCIAL CHARGE TAX,ER,0,0,0,0,0
9,EMPLOYER SPECIAL PAYROLL TAX,ER,0,0,0,0,0
10,EMPLOYER UNEMPLOYMENT TAX,ER,0,0,0,0,0
11,EMPLOYER DEBT REPAYMENT TAX,ER,0,0,0,0,0
12,EMPLOYER OLD FUND LIABILITY TX,ER,0,0,0,0,0
13,ER EMPLMT SECURITY ENHANCMT TX,ER,0,0,0,0,0
14,ER RE-EMPLMT PLACEMT TX,ER,0,0,0,0,0
15,ER JOB DEVMT ASSESSMT TX,ER,0,0,0,0,0
16,EMPLOYMENT TRAINING TAX,ER,0,0,0,0,0
17,EMPLOYER HEALTH INSURANCE TAX,ER,0,0,0,0,0
18,EMPLOYER WORKFORCE DEVLMT TX,ER,0,0,0,0,0
19,PAYROLL EXPENSE TAX,ER,0,0,0,0,0
20,EMPLOYEE UNEMPLOYMENT TAX,EE,0,0,0,0,0
21,EMPLOYEE DEBT REPAYMENT TAX,EE,0,0,0,0,0
22,EMPLOYEE OLD FUND LIABILITY TX,EE,0,0,0,0,0
23,EMPLOYEE HEALTH INSURANCE TAX,EE,0,0,0,0,0
24,EMPLOYEE WORKFORCE DEVLPMT TX,EE,0,0,0,0,0
25,EE COMBINED UI/WF&SWF/HC/DI/FLI TAX,EE,0,0,0,0,0
26,EMPLOYEE CHAUFFEURS LICENSE FEE,EE,0,0,0,0,0
27,EMPLOYER CHAUFFEURS LICENSE FEE,ER,0,0,0,0,0
28,ER COMBINED WF&SWF/HC/DI TAX,ER,0,0,0,0,0
29,SPECIAL ADMIN RESERVE FUND TAX,ER,0,0,0,0,0
30,EMPLOYER WORKER COMPENSATION TAX,ER,0,0,0,0,0
31,EMPLOYER DISABILITY TAX,ER,0,0,0,0,0
32,EMPLOYER ACCIDENT FUND TAX,ER,0,0,0,0,0
33,EMPLOYER MEDICAL AID FUND TAX,ER,0,0,0,0,0
34,EMPLOYER SUPLMTAL PENSION TX,ER,0,0,0,0,0
35,TRANSIT  DISTRICT EXCISE TAX,ER,0,0,0,0,0
36,WORKFORCE ENHANCEMENT FEE,ER,0,0,0,0,0
37,ADMINISTRATIVE CONTINGENCY FUND TAX,ER,0,0,0,0,0
38,EMPLOYER INVESTMENT FEE,ER,0,0,0,0,0
39,EMPLOYMENT ADMINISTRATION FUND,ER,0,0,0,0,0
40,EMPLOYEE WORKER COMPENSATION TAX,EE,0,0,0,0,0
41,EMPLOYEE DISABILITY TAX,EE,0,0,0,0,0
42,EMPLOYEE SUPLMTAL PENSION TX,EE,0,0,0,0,0
43,EMPLOYEE MEDICAL AID FUND TAX,EE,0,0,0,0,0
44,EE MENTAL HEALTH TAX,EE,1,0,0,0,0
45,EMPLOYEE SENIOR CITIZEN TAX,EE,1,0,0,0,0
46,EMPLOYEE MENTAL HEALTH TAX,EE,1,0,0,0,0
47,JOINT ECONOMIC DEV. DISTRICT,EE,1,0,0,0,0
48,EMPLOYEE VOLUNTARY DISABILITY TAX,EE,0,0,0,0,0
49,EE SEN CIT/MNTAL HLT/TRANSP TX,EE,1,0,0,0,0
50,EMPLOYEE TRANSPORTATION TAX,EE,1,0,0,0,0
51,EMPLOYEE OCCUPATION TAX,EE,1,0,0,0,0
52,EMPLOYER HEAD TAX,ER,0,0,0,0,0
53,EMPLOYEE SCHOOL TAX,EE,1,0,0,0,0
54,EMPLOYER OCCUPATION TAX,ER,1,0,0,0,0
55,EMPLOYEE RAILROAD RTMT TIER1 SOC S,EE,0,0,2,0,0
56,EMPLOYEE RAILROAD RTMT TIER2 SOC S,EE,0,0,4,0,0
57,EMPLOYER RAILROAD RTMT TIER1 SOC S,ER,0,0,2,0,0
58,EMPLOYER RAILROAD RTMT TIER2 SOC S,ER,0,0,4,0,0
59,EMPLOYEE RAILROAD RTMT TIER1 MEDIC,EE,0,0,2,0,0
60,EMPLOYER RAILROAD RTMT TIER1 MEDIC,ER,0,0,2,0,0
61,EMPLOYEE RETIREMENT PLAN-S.S,EE,0,0,0,0,0
62,EMPLOYEE RETIREMENT PLAN-MED.,EE,0,0,0,0,0
63,EMPLOYER RETIREMENT PLAN-S.S,ER,0,0,0,0,0
64,EMPLOYER RETIREMENT PLAN-MED.,ER,0,0,0,0,0
65,EMPLOYER SUPPLEMENTAL RAILROAD RTMT,ER,0,0,2,0,0
68,P.E.R.S. - S.S. - EMPLOYER PICK-UP,EE,0,0,0,0,0
69,P.E.R.S. - MED. - EMPLOYER PICK-UP,EE,0,0,0,0,0
70,PENSION PERIODIC WITHHOLDING,EE,0,1,0,0,0
71,PENSION N.P. ELIGIBLE ROLLOVER,EE,0,1,0,0,0
72,PENSION N.P. NONQUALIFYING,EE,0,1,0,0,0
73,PREMATURE DIST FROM QUALIFIED PLANS,EE,0,1,0,0,0
75,JOB DEVELOPMENT FEE,EE,0,0,0,0,0
76,CITY SERVICE FEE,EE,0,0,0,0,0
77,EMPLOYER VOLUNTARY DISABILITY TAX,ER,0,0,0,0,0
78,UNEMPLOYMENT SURCHARGE TAX,ER,0,0,0,0,0
79,WAGE AND SALARY TAX,EE,1,0,0,0,0
80,EMPLOYER WAGE SECURITY FUND TAX,ER,0,0,0,0,0
81,DISABILITY INSURANCE VP ASMENT TAX,ER,0,0,0,0,0
82,UNEMPLOYMENT SOLVENCY TAX SURCHARGE,ER,0,0,0,0,0
84,LOCAL SERVICES TAX,EE,1,0,0,0,0
85,COMPETITIVENESS SKILLS SCHLR FUND,ER,0,0,0,0,0
86,EE JOB DEVMT ASSESSMT TX,EE,1,0,0,0,0
87,EMPLOYEE FAMILY LEAVE INSURANCE TAX,EE,0,0,0,0,0
88,EMPLOYEE FAMILY LEAVE INS-VOL TAX,EE,0,0,0,0,0
89,UI INTEREST ASSESSMENT FEE,ER,0,0,0,0,0
90,EMPLOYER STAY AT WORK PROGRAM TAX,ER,0,0,0,0,0
91,EMPLOYEE STAY AT WORK PROGRAM TAX,EE,0,0,0,0,0
92,ER MEDICAL ASST CONTRIBUTION TAX,ER,0,0,0,0,0
93,NON-RESIDENT ALIEN ADDITIONAL TAX,EE,1,0,0,0,0
94,TECHNOLOGY FUND TAX,ER,0,0,0,0,0
95,EMPLOYER ADMINISTRATIVE FEE,ER,0,0,0,0,0
96,STATEWIDE TRANSIT TAX,EE,1,0,0,0,0
98,EMPLOYER FAMILY LEAVE INSURANCE TAX,ER,0,0,0,0,0
99,EMPLOYEE MEDICAL LEAVE INSUR TAX,EE,0,0,0,0,0
100,EMPLOYER MEDICAL LEAVE INSUR TAX,ER,0,0,0,0,0
101,EMPLOYER FAMILY LEAVE INS-VOL TAX,ER,0,0,0,0,0
102,EMPLOYEE MEDICAL LEAVE INS-VOL TAX,EE,0,0,0,0,0
103,EMPLOYER MEDICAL LEAVE INS-VOL TAX,ER,0,0,0,0,0
104,EMPLOYEE TIF TAX,EE,1,0,0,0,0
105,EMPLOYER PAID CITY SERVICE FEE,ER,0,0,0,0,0
200,ER INDIVIDUAL PSL CREDIT,ER,0,0,0,0,0
201,ER FAMILY  PSL CREDIT,ER,0,0,0,0,0
202,ER EXTENDED PFML  CREDIT,ER,0,0,0,0,0
203,ER MEDICARE LEAVE CREDIT,ER,0,0,0,0,0
204,ER EMPLOYEE RETENTION CREDIT,ER,0,0,0,0,0
205,ER SOCIAL SECURITY LEAVE CREDIT,ER,0,0,0,0,0
206,ER SOCIAL SECURITY TAX PMT DEFERRAL,ER,0,0,0,0,0
501,BANKRUPTCY,EE,0,0,0,1,1
502,CURRENT SUPPORT,EE,0,0,0,3,1
503,FEDERAL TAX LEVY,EE,0,0,0,2,1
504,STATE TAX LEVY,EE,0,0,0,4,1
505,STUDENT LOAN,EE,0,0,0,5,1
506,ADMINISTRATIVE WAGE GARNISHMENT,EE,0,0,0,5,0
507,CREDITOR GARNISHMENT,NA,0,0,0,5,1
508,CRIMINAL RESTITUTION,EE,0,0,0,5,1
509,COURT COSTS,EE,0,0,0,7,1
510,CURRENT SUPPORT ARREARS,EE,0,0,0,3,1
511,MEDICAL SUPPORT,EE,0,0,0,3,1
512,MEDICAL SUPPORT ARREARS,EE,0,0,0,3,1
513,SPOUSAL SUPPORT,EE,0,0,0,3,1
514,SPOUSAL SUPPORT ARREARS,EE,0,0,0,3,1
515,VOL WAGE ASSIGNMENT,EE,0,0,0,6,1
516,OUT OF STATE SUPPORT,EE,0,0,0,3,1
517,STATE STUDENT LOAN,EE,0,0,0,5,0
518,STUDENT LOAN EMPLOYER FEE,EE,0,0,0,7,0
519,SUPPORT EMPLOYER FEE,EE,0,0,0,9,1
520,STATE LEVY EMPLOYER FEE,EE,0,0,0,7,0
521,CREDITOR GARNISHMENT EMPLOYER FEE,EE,0,0,0,7,0
522,CRIMINAL RESTITUTION EMPLOYER FEE,EE,0,0,0,7,0
523,VOL WAGE ASSIGNMENT EMPLOYER FEE,EE,0,0,0,7,0
524,ER PAID CREDITOR GARNISHMENT FEE,NA,0,0,0,7,0
525,STATE BENEFIT LEVY ER FEE,EE,0,0,0,7,0
526,ADMIN WAGE GARNISHMENT EMPLOYER FEE,EE,0,0,0,7,0
527,NON-COURT ORDERED STUDENT LOAN,EE,0,0,0,5,1
528,LUMP SUM SUPPORT,EE,0,0,0,10,1
529,STATE AGENCY NON-TAX DEBT LEVY,EE,0,0,0,5,0
531,STATE BENEFIT LEVY,EE,0,0,0,4,0
532,MEDICAID DEBT,EE,0,0,0,5,1
533,MEDICAID DEBT FEE,EE,0,0,0,7,0
535,SUPPORT AGENCY FEE,EE,0,0,0,9,1
545,MEDICAL SUPPORT AGENCY FEE,EE,0,0,0,9,1
600,TOTAL SUPPORT,EE,0,0,0,8,1
888,EE TAX-CALC DEPENDENCY-DO NOT USE,EE,0,0,0,0,0
999,TAX CALC SPECIAL USE LIMITS,ER,0,0,0,0,0
